{
  "id": "in_2bhk_thiruvananthapuram_kowdiar",
  "metadata": {
    "region": "india",
    "country": "India",
    "city_inspiration": "Thiruvananthapuram",
    "size_label": "2bhk",
    "size_band": "2bed",
    "total_area_sqm": 75,
    "bedrooms": 2,
    "bathrooms": 2,
    "style": "Thiruvananthapuram Kowdiar 2 BHK (Napier Museum upmarket)",
    "description": "A 2 BHK in Thiruvananthapuram's Kowdiar locality — the upmarket residential zone near Kowdiar Palace and the Napier Museum, preferred by senior government officials and IT professionals, mid-rise flat, ~75 m² (808 sqft). Foyer, Living/Dining, Kitchen, Bathroom, WC, Master Bedroom, Bedroom 2. Source: 99acres.com / Housing.com Thiruvananthapuram Kowdiar.",
    "suitable_for": ["couple", "young_family"],
    "tags": ["india", "thiruvananthapuram", "kerala", "kowdiar", "2bed", "apartment_indian", "current_2020plus"]
  },
  "boundary": {
    "polygon": [[0,0],[10,0],[10,7.5],[0,7.5]],
    "wall_thickness_mm": 230,
    "ceiling_height_mm": 2800
  },
  "rooms": [
    { "id": "r_foyer", "name": "Foyer", "type": "entry",
      "polygon": [[0,0],[2,0],[2,2],[0,2]], "area_sqm": 4 },
    { "id": "r_living", "name": "Living/Dining", "type": "living",
      "polygon": [[2,0],[7,0],[7,4.5],[2,4.5]], "area_sqm": 22.5 },
    { "id": "r_kitchen", "name": "Kitchen", "type": "kitchen",
      "polygon": [[7,0],[10,0],[10,4.5],[7,4.5]], "area_sqm": 13.5 },
    { "id": "r_bath", "name": "Bathroom", "type": "bathroom",
      "polygon": [[0,2],[2,2],[2,5.5],[0,5.5]], "area_sqm": 7 },
    { "id": "r_wc", "name": "WC", "type": "wc",
      "polygon": [[0,5.5],[2,5.5],[2,7.5],[0,7.5]], "area_sqm": 4 },
    { "id": "r_master", "name": "Master Bedroom", "type": "master_bedroom",
      "polygon": [[2,4.5],[6,4.5],[6,7.5],[2,7.5]], "area_sqm": 12 },
    { "id": "r_bedroom2", "name": "Bedroom 2", "type": "bedroom",
      "polygon": [[6,4.5],[10,4.5],[10,7.5],[6,7.5]], "area_sqm": 12 }
  ],
  "doors": [
    { "from": "outside", "to": "r_foyer", "position": [0,1], "width_mm": 1000, "is_main_entry": true },
    { "from": "r_foyer", "to": "r_living", "position": [2,1], "width_mm": 900 },
    { "from": "r_living", "to": "r_kitchen", "position": [7,2.25], "width_mm": 900 },
    { "from": "r_foyer", "to": "r_bath", "position": [1,2], "width_mm": 700 },
    { "from": "r_bath", "to": "r_wc", "position": [1,5.5], "width_mm": 700 },
    { "from": "r_living", "to": "r_master", "position": [4,4.5], "width_mm": 900 },
    { "from": "r_kitchen", "to": "r_bedroom2", "position": [8.5,4.5], "width_mm": 900 },
    { "from": "r_master", "to": "r_bedroom2", "position": [6,6], "width_mm": 800 },
    { "from": "r_wc", "to": "r_master", "position": [2,6.5], "width_mm": 700 }
  ],
  "windows": [
    { "room": "r_living", "position": [4.5,0], "width_mm": 1800 },
    { "room": "r_kitchen", "position": [8.5,0], "width_mm": 1200 },
    { "room": "r_master", "position": [4,7.5], "width_mm": 1500 },
    { "room": "r_bedroom2", "position": [8,7.5], "width_mm": 1500 },
    { "room": "r_bath", "position": [0,3.75], "width_mm": 600 }
  ]
}
