{
  "id": "eu_fr_2bed_toulouse_capitole",
  "metadata": {
    "region": "europe",
    "country": "France",
    "city_inspiration": "Toulouse",
    "size_label": "T3",
    "size_band": "2bed",
    "total_area_sqm": 75,
    "bedrooms": 2,
    "bathrooms": 1,
    "style": "Toulouse Capitole T3 (Pink City haussmannien)",
    "description": "A Toulouse Capitole T3 apartment — La Ville Rose haussmannien-influenced terracotta brick block, ~75 m². Entrée, Séjour-Salle à manger, Cuisine, Salle de bains, WC, two Chambres. Source: SeLoger Toulouse 31000.",
    "suitable_for": ["couple", "young_family"],
    "tags": ["france", "toulouse", "altbau_high_ceilings", "2bed", "single_floor", "vintage_traditional"]
  },
  "boundary": {
    "polygon": [[0,0],[15,0],[15,5],[0,5]],
    "wall_thickness_mm": 380,
    "ceiling_height_mm": 3100
  },
  "rooms": [
    { "id": "r_entree", "name": "Entrée", "type": "entry",
      "polygon": [[0,0],[2,0],[2,3],[0,3]], "area_sqm": 6 },
    { "id": "r_sejour", "name": "Séjour-Salle à manger", "type": "living",
      "polygon": [[2,0],[9,0],[9,3],[2,3]], "area_sqm": 21 },
    { "id": "r_cuisine", "name": "Cuisine", "type": "kitchen",
      "polygon": [[9,0],[12,0],[12,3],[9,3]], "area_sqm": 9 },
    { "id": "r_sdb", "name": "Salle de bains", "type": "bathroom",
      "polygon": [[12,0],[15,0],[15,3],[12,3]], "area_sqm": 9 },
    { "id": "r_wc", "name": "WC", "type": "wc",
      "polygon": [[0,3],[2,3],[2,5],[0,5]], "area_sqm": 4 },
    { "id": "r_chambre1", "name": "Chambre 1", "type": "master_bedroom",
      "polygon": [[2,3],[8,3],[8,5],[2,5]], "area_sqm": 12 },
    { "id": "r_chambre2", "name": "Chambre 2", "type": "bedroom",
      "polygon": [[8,3],[15,3],[15,5],[8,5]], "area_sqm": 14 }
  ],
  "doors": [
    { "from": "outside", "to": "r_entree", "position": [1,0], "width_mm": 1000, "is_main_entry": true },
    { "from": "r_entree", "to": "r_sejour", "position": [2,1.5], "width_mm": 1000 },
    { "from": "r_sejour", "to": "r_cuisine", "position": [9,1.5], "width_mm": 1000 },
    { "from": "r_cuisine", "to": "r_sdb", "position": [12,1.5], "width_mm": 800 },
    { "from": "r_entree", "to": "r_wc", "position": [1,3], "width_mm": 700 },
    { "from": "r_sejour", "to": "r_chambre1", "position": [5,3], "width_mm": 900 },
    { "from": "r_cuisine", "to": "r_chambre2", "position": [10.5,3], "width_mm": 900 },
    { "from": "r_sdb", "to": "r_chambre2", "position": [13.5,3], "width_mm": 900 },
    { "from": "r_chambre1", "to": "r_chambre2", "position": [8,4], "width_mm": 800 }
  ],
  "windows": [
    { "room": "r_sejour", "position": [5.5,0], "width_mm": 2400 },
    { "room": "r_cuisine", "position": [10.5,0], "width_mm": 1500 },
    { "room": "r_sdb", "position": [13.5,0], "width_mm": 900 },
    { "room": "r_chambre1", "position": [5,5], "width_mm": 1800 },
    { "room": "r_chambre2", "position": [11.5,5], "width_mm": 2400 }
  ]
}
