{
  "id": "gl_us_2bed_boston_brownstone",
  "metadata": {
    "region": "global",
    "country": "United States",
    "city_inspiration": "Boston",
    "size_label": "2bed",
    "size_band": "2bed",
    "total_area_sqm": 95,
    "bedrooms": 2,
    "bathrooms": 2,
    "style": "Boston 2-bed brownstone (Back Bay Victorian)",
    "description": "A Boston Back Bay 2-bed brownstone — Victorian rowhouse conversion, ~95 m² (1020 sqft). Foyer, Living, Dining, Kitchen, two Bedrooms, two Baths, Bay window. Source: zillow.com Boston Back Bay.",
    "suitable_for": ["young_family", "couple"],
    "tags": ["united_states", "boston", "vintage_traditional", "2bed", "altbau_high_ceilings", "single_floor"]
  },
  "boundary": {
    "polygon": [[0,0],[10,0],[10,9],[0,9]],
    "wall_thickness_mm": 380,
    "ceiling_height_mm": 3500
  },
  "rooms": [
    { "id": "r_foyer", "name": "Foyer", "type": "entry",
      "polygon": [[0,0],[2,0],[2,3],[0,3]], "area_sqm": 6 },
    { "id": "r_living", "name": "Living", "type": "living",
      "polygon": [[2,0],[6,0],[6,5],[2,5]], "area_sqm": 20 },
    { "id": "r_dining", "name": "Dining", "type": "dining",
      "polygon": [[6,0],[8,0],[8,5],[6,5]], "area_sqm": 10 },
    { "id": "r_kitchen", "name": "Kitchen", "type": "kitchen",
      "polygon": [[8,0],[10,0],[10,5],[8,5]], "area_sqm": 10 },
    { "id": "r_powder", "name": "Powder", "type": "wc",
      "polygon": [[0,3],[2,3],[2,4.5],[0,4.5]], "area_sqm": 3 },
    { "id": "r_bath1", "name": "Bath 1", "type": "bathroom",
      "polygon": [[0,4.5],[2,4.5],[2,7],[0,7]], "area_sqm": 5 },
    { "id": "r_master", "name": "Master Bedroom", "type": "master_bedroom",
      "polygon": [[2,5],[6,5],[6,7],[2,7]], "area_sqm": 8 },
    { "id": "r_bed2", "name": "Bedroom 2", "type": "bedroom",
      "polygon": [[6,5],[10,5],[10,7],[6,7]], "area_sqm": 8 },
    { "id": "r_bath2", "name": "Bath 2", "type": "bathroom",
      "polygon": [[8,7],[10,7],[10,8],[8,8]], "area_sqm": 2 },
    { "id": "r_corridor", "name": "Corridor", "type": "corridor",
      "polygon": [[0,7],[8,7],[8,8],[0,8]], "area_sqm": 8 },
    { "id": "r_baywindow", "name": "Bay window", "type": "balcony",
      "polygon": [[0,8],[10,8],[10,9],[0,9]], "area_sqm": 10 }
  ],
  "doors": [
    { "from": "outside", "to": "r_foyer", "position": [0.5, 0], "width_mm": 1100, "is_main_entry": true },
    { "from": "r_foyer", "to": "r_living", "position": [2, 1.5], "width_mm": 1100 },
    { "from": "r_foyer", "to": "r_powder", "position": [1, 3], "width_mm": 700 },
    { "from": "r_powder", "to": "r_bath1", "position": [1, 4.5], "width_mm": 700 },
    { "from": "r_living", "to": "r_dining", "position": [6, 2.5], "width_mm": 1500 },
    { "from": "r_dining", "to": "r_kitchen", "position": [8, 2.5], "width_mm": 1100 },
    { "from": "r_living", "to": "r_master", "position": [4, 5], "width_mm": 900 },
    { "from": "r_dining", "to": "r_bed2", "position": [7, 5], "width_mm": 900 },
    { "from": "r_kitchen", "to": "r_bed2", "position": [9, 5], "width_mm": 900 },
    { "from": "r_master", "to": "r_bed2", "position": [6, 6], "width_mm": 800 },
    { "from": "r_bath1", "to": "r_corridor", "position": [1, 7], "width_mm": 700 },
    { "from": "r_master", "to": "r_corridor", "position": [4, 7], "width_mm": 800 },
    { "from": "r_bed2", "to": "r_corridor", "position": [7, 7], "width_mm": 800 },
    { "from": "r_bed2", "to": "r_bath2", "position": [9, 7], "width_mm": 700 },
    { "from": "r_corridor", "to": "r_baywindow", "position": [4, 8], "width_mm": 1500, "swing": "slide" },
    { "from": "r_bath2", "to": "r_baywindow", "position": [9, 8], "width_mm": 700 }
  ],
  "windows": [
    { "room": "r_living", "position": [4, 0], "width_mm": 2400 },
    { "room": "r_dining", "position": [7, 0], "width_mm": 1500 },
    { "room": "r_kitchen", "position": [9, 0], "width_mm": 1500 },
    { "room": "r_master", "position": [2, 6], "width_mm": 1200 },
    { "room": "r_bed2", "position": [10, 6], "width_mm": 1500 },
    { "room": "r_baywindow", "position": [5, 9], "width_mm": 3000 },
    { "room": "r_bath1", "position": [0, 5.75], "width_mm": 600 },
    { "room": "r_foyer", "position": [0, 1.5], "width_mm": 800 }
  ]
}
