{
  "id": "eu_nl_3bed_rotterdam_kralingen_rijtjeshuis",
  "metadata": {
    "region": "europe",
    "country": "Netherlands",
    "city_inspiration": "Rotterdam",
    "size_label": "3bed",
    "size_band": "3bed",
    "total_area_sqm": 110,
    "bedrooms": 3,
    "bathrooms": 1,
    "style": "Rotterdam Kralingen Rijtjeshuis (single-floor variant of typical 3-storey)",
    "description": "A Rotterdam Kralingen / IJsseldijk Rijtjeshuis single-floor variant — typical 115 m² 3-storey compressed. Hal, Woonkamer, open Keuken, WC, Achtertuin, Master + 2 Slaapk + Badk + Hobby. Brick rijtjeshuis aligned with dike. Source: funda.nl Rotterdam Kralingen.",
    "suitable_for": ["young_family", "growing_family"],
    "tags": ["netherlands", "rotterdam", "rijtjeshuis", "3bed", "current_2020plus", "garten", "single_floor"]
  },
  "boundary": {
    "polygon": [[0,0],[10,0],[10,11],[0,11]],
    "wall_thickness_mm": 280,
    "ceiling_height_mm": 2800
  },
  "rooms": [
    { "id": "r_hal", "name": "Hal", "type": "entry",
      "polygon": [[0,0],[2,0],[2,3],[0,3]], "area_sqm": 6 },
    { "id": "r_woonk", "name": "Woonkamer", "type": "living",
      "polygon": [[2,0],[7,0],[7,5],[2,5]], "area_sqm": 25 },
    { "id": "r_keuken", "name": "Open Keuken", "type": "kitchen",
      "polygon": [[7,0],[10,0],[10,4],[7,4]], "area_sqm": 12 },
    { "id": "r_wc", "name": "WC", "type": "wc",
      "polygon": [[0,3],[2,3],[2,5],[0,5]], "area_sqm": 4 },
    { "id": "r_storage", "name": "Storage", "type": "store",
      "polygon": [[7,4],[10,4],[10,5],[7,5]], "area_sqm": 3 },
    { "id": "r_master", "name": "Master Slaapkamer", "type": "master_bedroom",
      "polygon": [[0,5],[4,5],[4,8],[0,8]], "area_sqm": 12 },
    { "id": "r_slaapk2", "name": "Slaapkamer 2", "type": "bedroom",
      "polygon": [[4,5],[7,5],[7,8],[4,8]], "area_sqm": 9 },
    { "id": "r_slaapk3", "name": "Slaapkamer 3", "type": "bedroom",
      "polygon": [[7,5],[10,5],[10,8],[7,8]], "area_sqm": 9 },
    { "id": "r_badk", "name": "Badkamer", "type": "bathroom",
      "polygon": [[0,8],[3,8],[3,10],[0,10]], "area_sqm": 6 },
    { "id": "r_hobby", "name": "Hobbykamer", "type": "study",
      "polygon": [[3,8],[7,8],[7,10],[3,10]], "area_sqm": 8 },
    { "id": "r_overloop", "name": "Overloop", "type": "corridor",
      "polygon": [[7,8],[10,8],[10,10],[7,10]], "area_sqm": 6 },
    { "id": "r_achtertuin", "name": "Achtertuin", "type": "balcony",
      "polygon": [[0,10],[10,10],[10,11],[0,11]], "area_sqm": 10 }
  ],
  "doors": [
    { "from": "outside", "to": "r_hal", "position": [0.5, 0], "width_mm": 1100, "is_main_entry": true },
    { "from": "r_hal", "to": "r_woonk", "position": [2, 1.5], "width_mm": 1200 },
    { "from": "r_hal", "to": "r_wc", "position": [1, 3], "width_mm": 700 },
    { "from": "r_woonk", "to": "r_keuken", "position": [7, 2], "width_mm": 1500 },
    { "from": "r_keuken", "to": "r_storage", "position": [8.5, 4], "width_mm": 800 },
    { "from": "r_woonk", "to": "r_master", "position": [3, 5], "width_mm": 900 },
    { "from": "r_woonk", "to": "r_slaapk2", "position": [5.5, 5], "width_mm": 900 },
    { "from": "r_storage", "to": "r_slaapk3", "position": [8.5, 5], "width_mm": 900 },
    { "from": "r_master", "to": "r_slaapk2", "position": [4, 6.5], "width_mm": 800 },
    { "from": "r_slaapk2", "to": "r_slaapk3", "position": [7, 6.5], "width_mm": 800 },
    { "from": "r_master", "to": "r_badk", "position": [1.5, 8], "width_mm": 800 },
    { "from": "r_slaapk2", "to": "r_hobby", "position": [5.5, 8], "width_mm": 900 },
    { "from": "r_slaapk3", "to": "r_overloop", "position": [8.5, 8], "width_mm": 900 },
    { "from": "r_hobby", "to": "r_overloop", "position": [7, 9], "width_mm": 800 },
    { "from": "r_badk", "to": "r_achtertuin", "position": [1.5, 10], "width_mm": 800, "swing": "slide" },
    { "from": "r_hobby", "to": "r_achtertuin", "position": [5, 10], "width_mm": 1500, "swing": "slide" },
    { "from": "r_overloop", "to": "r_achtertuin", "position": [8.5, 10], "width_mm": 800, "swing": "slide" }
  ],
  "windows": [
    { "room": "r_woonk", "position": [4.5, 0], "width_mm": 2400 },
    { "room": "r_keuken", "position": [8.5, 0], "width_mm": 1800 },
    { "room": "r_keuken", "position": [10, 2], "width_mm": 1500 },
    { "room": "r_master", "position": [0, 6.5], "width_mm": 1500 },
    { "room": "r_slaapk3", "position": [10, 6.5], "width_mm": 1500 },
    { "room": "r_achtertuin", "position": [5, 11], "width_mm": 3000 },
    { "room": "r_wc", "position": [0, 4], "width_mm": 600 },
    { "room": "r_hal", "position": [0, 1.5], "width_mm": 800 }
  ]
}
